{
  "focus": {
    "action": "Review these lows and practice recognizing low/mid choices; avoid crouching continuously.",
    "action_reviewed": true,
    "metric": "low_defense",
    "min_opportunities": 5,
    "mode": "automatic",
    "reason": "0/7 successful observed opportunities; 7 failures",
    "state": "observed"
  },
  "format_version": 1,
  "freshness": {
    "latest_completed_round": 2,
    "latest_learning_round": 2,
    "latest_recording_round": 2,
    "learning_ahead_rounds": [],
    "pending_learning_rounds": []
  },
  "habits": {},
  "metrics": {
    "low_defense": {
      "estimated": false,
      "evidence": [
        {
          "event": {
            "actor": 1,
            "damage": 10,
            "hit_level": "low",
            "kind": "hit",
            "target": 0
          },
          "opportunity": {
            "frame": 1,
            "line": 1,
            "round": 1
          },
          "outcome": "failure",
          "response": null
        },
        {
          "event": {
            "actor": 1,
            "damage": 10,
            "hit_level": "low",
            "kind": "hit",
            "target": 0
          },
          "opportunity": {
            "frame": 2,
            "line": 2,
            "round": 1
          },
          "outcome": "failure",
          "response": null
        },
        {
          "event": {
            "actor": 1,
            "damage": 10,
            "hit_level": "low",
            "kind": "hit",
            "target": 0
          },
          "opportunity": {
            "frame": 3,
            "line": 3,
            "round": 1
          },
          "outcome": "failure",
          "response": null
        }
      ],
      "evidence_total": 7,
      "failures": 7,
      "label": "Low defense",
      "opportunities": 7,
      "state": "observed",
      "successes": 0,
      "value": 0.0
    },
    "punish_conversion": {
      "estimated": true,
      "evidence": [],
      "evidence_total": 0,
      "failures": 0,
      "label": "Estimated punish conversion",
      "opportunities": 0,
      "state": "no_opportunities",
      "successes": 0,
      "value": null
    },
    "throw_defense": {
      "estimated": false,
      "evidence": [],
      "evidence_total": 0,
      "failures": 0,
      "label": "Throw defense",
      "opportunities": 0,
      "state": "no_opportunities",
      "successes": 0,
      "value": null
    }
  },
  "moments": [
    {
      "event": {
        "actor": 1,
        "damage": 10,
        "hit_level": "low",
        "kind": "hit",
        "target": 0
      },
      "metric_outcomes": {
        "low_defense": {
          "outcome": "failure",
          "response": null
        }
      },
      "metrics": [
        "low_defense"
      ],
      "outcome": "failure",
      "reference": {
        "frame": 1,
        "line": 1,
        "round": 1
      },
      "response": null
    },
    {
      "event": {
        "actor": 1,
        "damage": 10,
        "hit_level": "low",
        "kind": "hit",
        "target": 0
      },
      "metric_outcomes": {
        "low_defense": {
          "outcome": "failure",
          "response": null
        }
      },
      "metrics": [
        "low_defense"
      ],
      "outcome": "failure",
      "reference": {
        "frame": 2,
        "line": 2,
        "round": 1
      },
      "response": null
    },
    {
      "event": {
        "actor": 1,
        "damage": 10,
        "hit_level": "low",
        "kind": "hit",
        "target": 0
      },
      "metric_outcomes": {
        "low_defense": {
          "outcome": "failure",
          "response": null
        }
      },
      "metrics": [
        "low_defense"
      ],
      "outcome": "failure",
      "reference": {
        "frame": 3,
        "line": 3,
        "round": 1
      },
      "response": null
    },
    {
      "event": {
        "actor": 1,
        "damage": 10,
        "hit_level": "low",
        "kind": "hit",
        "target": 0
      },
      "metric_outcomes": {
        "low_defense": {
          "outcome": "failure",
          "response": null
        }
      },
      "metrics": [
        "low_defense"
      ],
      "outcome": "failure",
      "reference": {
        "frame": 4,
        "line": 4,
        "round": 1
      },
      "response": null
    },
    {
      "event": {
        "actor": 1,
        "damage": 10,
        "hit_level": "low",
        "kind": "hit",
        "target": 0
      },
      "metric_outcomes": {
        "low_defense": {
          "outcome": "failure",
          "response": null
        }
      },
      "metrics": [
        "low_defense"
      ],
      "outcome": "failure",
      "reference": {
        "frame": 5,
        "line": 5,
        "round": 1
      },
      "response": null
    }
  ],
  "moments_total": 7,
  "quality": "observed",
  "recording_sha256": "c72ea663ecf7f13cea2c467b2b0e8f1222246754ff9010f4a59b8b4132afc4b1",
  "session_id": "insight-example",
  "snapshot_id": "be389a9780186d6e15c00052bda3de55582b730c4ab29a0541b0bfb820c5dc1e",
  "synthetic": true
}
